{
  "schema_version": "1.0",
  "opportunity_id": "00000000-0000-4000-8000-000000000001",
  "title": "Invoice 3-Way Match Automation",
  "department": "Finance",
  "status": "draft",
  "priority_rank": null,
  "quality_scores": {
    "opportunity_rating": 72,
    "conversation_quality": 65,
    "build_readiness": 58,
    "rationale": {
      "opportunity_rating": "Clear volume and pain described in transcript.",
      "conversation_quality": "Some gaps on access paths and test data.",
      "build_readiness": "ERP integration details need confirmation."
    }
  },
  "kpis": [],
  "systems": [],
  "rules": [],
  "exceptions": [],
  "access_needs": [],
  "evolution_stages": [],
  "open_items": [],
  "chapters": [
    { "chapter_id": "0", "title": "About this document", "body": "", "source_refs": [] },
    { "chapter_id": "1", "title": "Management summary", "body": "", "source_refs": [] },
    { "chapter_id": "2", "title": "Starting point: the process today", "body": [], "source_refs": [] },
    { "chapter_id": "3", "title": "Aim & success measurement", "body": [], "source_refs": [] },
    { "chapter_id": "4", "title": "The solution and the to-be process", "body": [], "source_refs": [] },
    { "chapter_id": "5", "title": "How it works in detail", "body": [], "source_refs": [] },
    { "chapter_id": "6", "title": "How it is built - systems, data flow, integration", "body": [], "source_refs": [] },
    { "chapter_id": "7", "title": "What we need from the client", "body": [], "source_refs": [] },
    { "chapter_id": "8", "title": "Security, data protection & human control", "body": "", "source_refs": [] },
    { "chapter_id": "9", "title": "Business case & ROI", "body": [], "source_refs": [] },
    { "chapter_id": "10", "title": "Complexity, effort & timeline", "body": [], "source_refs": [] },
    { "chapter_id": "11", "title": "Trustworthiness - quality gates", "body": [], "source_refs": [] },
    { "chapter_id": "12", "title": "Evolution stages", "body": [], "source_refs": [] },
    { "chapter_id": "13", "title": "Next steps & glossary", "body": [], "source_refs": [] }
  ],
  "version": 1,
  "generated_from": ["transcript-001"],
  "previous_version_id": null,
  "change_log": ["Initial generation"],
  "created_at": "2026-08-24T12:00:00Z",
  "updated_at": "2026-08-24T12:00:00Z"
}
